"","factor","taxa","tips","node","clade","other","model"
"1",1,"Oligoryzomys",20,1080,0.73,0.41,"infection"
"2",2,"Dicrostonyx, Phenacomys, Arborimus, Ondatra, Neofiber, Lemmus, Synaptomys, Lemmiscus, Microtus, Myodes",43,605,0.23,0.44,"infection"
"3",3,"Peromyscus_pembertoni, Peromyscus_interparietalis, Peromyscus_mekisturus, Peromyscus_crinitus, Peromyscus_dickeyi, Peromyscus_spicilegus, Peromyscus_winkelmanni, Peromyscus_aztecus, Peromyscus_hylocetes, Peromyscus_boylii, Peromyscus_simulus, Peromyscus_stephani, Peromyscus_madrensis, Peromyscus_beatae, Peromyscus_levipes, Peromyscus_carletoni, Peromyscus_schmidlyi, Peromyscus_eva, Peromyscus_furvus, Peromyscus_attwateri, Peromyscus_nasutus, Peromyscus_difficilis, Peromyscus_truei, Peromyscus_gratus, Peromyscus_ochraventer",25,721,0.62,0.41,"infection"
"4",4,"Oxymycterus_hispidus, Oxymycterus_quaestor, Oxymycterus_angularis, Oxymycterus_rufus, Oxymycterus_josei, Oxymycterus_caparoae",6,835,0.74,0.42,"infection"
"5",5,"Calomys_fecundus, Calomys_venustus, Calomys_callosus, Calomys_tocantinsi, Calomys_cerqueirai, Calomys_expulsus, Calomys_tener, Calomys_laucha",8,1050,0.68,0.42,"infection"
"6",6,"Rhipidomys_ochrogaster, Rhipidomys_ipukensis, Rhipidomys_venezuelae, Rhipidomys_nitela, Rhipidomys_emiliae, Rhipidomys_mastacalis, Rhipidomys_leucodactylus, Rhipidomys_gardneri, Rhipidomys_itoan, Rhipidomys_tribei, Rhipidomys_macrurus, Rhipidomys_cariri, Rhipidomys_fulviventer",13,962,0.61,0.42,"infection"
"7",1,"Oligoryzomys",20,1080,0.32,0.2,"competence"
"8",2,"Oecomys_bicolor, Oecomys_roberti, Oecomys_superans, Oecomys_trinitatis, Oecomys_mamorae, Oecomys_flavicans, Oecomys_sydandersoni",7,1176,0.34,0.2,"competence"
"9",3,"Oryzomys_couesi, Oryzomys_nelsoni, Oryzomys_antillarum, Oryzomys_dimidiatus, Oryzomys_gorgasi, Oryzomys_palustris",6,1119,0.34,0.2,"competence"
